{
  "schema": "OFG-EA-STATE-ROOT-V1",
  "root_id": "OFG-EA-WF3-MRE3-PHASE8A-E2-R2-ROOT",
  "repository": "Taro102/OFG-Engineering-Atlas",
  "branch": "main",
  "base_commit": "ecb3e1b97cb339425ab7043134276b1751ed77ac",
  "master_instance": "T1-G2",
  "master_epoch": 2,
  "mode": "LEGACY_COMPATIBILITY",
  "engineering_pin": {
    "baseline_id": "OFG-EA-B000-REV3-REVW3-REVS-2031-04-19",
    "staging_pin": "OFG-EA-C010-INTEGRATED-STAGING-R1",
    "working_view": "OFG-EA-B000-PLUS-C001-C002-C003-C004-C005-C006-C007-C008-C009-C010-STAGING-R1",
    "configuration_cut": "2031-04-19",
    "active_cycle": "OFG-EA-CYCLE-011"
  },
  "legacy_manifest_ref": {
    "path": "state/legacy_compatibility_manifest.json",
    "byte_count": 56896,
    "sha256": "56e6394dfbee7ccea7537f76d1616b064954be94bb9d66dab03de61d0936481f"
  },
  "legacy_inputs_root_sha256": "b8723daf6230116df28442e011342ded5de9480766b4ce40aed6a662853bf6bb",
  "legacy_input_file_count": 30,
  "legacy_inputs": [
    {
      "repository_relative_path": "control/authority_activation.json",
      "base_commit": "ecb3e1b97cb339425ab7043134276b1751ed77ac",
      "git_blob_sha": "576efca905b3ac142737602b0d1c4ba5fb9bca2f",
      "byte_count": 3978,
      "sha256": "1506e7129d2baa389a4fa1d63be20ed17854050fc3d60a6c088abc26076615ab",
      "source_status": "LEGACY_COMPATIBILITY_AUTHORITATIVE_INPUT",
      "plane": "CONTROL",
      "semantic_rule": "INHERIT_EXISTING_RECORD_MEANING_AND_AUTHORITY_NO_RECLASSIFICATION"
    },
    {
      "repository_relative_path": "control/authority_model.json",
      "base_commit": "ecb3e1b97cb339425ab7043134276b1751ed77ac",
      "git_blob_sha": "a9b25d9132ff3e167994eebe0a66b3c915137cf0",
      "byte_count": 1135,
      "sha256": "0f63eec2015f4f04c2ee560abe51fc5dfe2a5e25cce03d32c5bfe73e55f96200",
      "source_status": "LEGACY_COMPATIBILITY_AUTHORITATIVE_INPUT",
      "plane": "CONTROL",
      "semantic_rule": "INHERIT_EXISTING_RECORD_MEANING_AND_AUTHORITY_NO_RECLASSIFICATION"
    },
    {
      "repository_relative_path": "control/configuration_state.json",
      "base_commit": "ecb3e1b97cb339425ab7043134276b1751ed77ac",
      "git_blob_sha": "e31df3de1a840edc520541666ea2787fd6923573",
      "byte_count": 410,
      "sha256": "ea7551a8fae8763baff3cf1a3ce7e405e4597f5bfe3864c08cde397b90e1f946",
      "source_status": "LEGACY_COMPATIBILITY_AUTHORITATIVE_INPUT",
      "plane": "CONTROL",
      "semantic_rule": "INHERIT_EXISTING_RECORD_MEANING_AND_AUTHORITY_NO_RECLASSIFICATION"
    },
    {
      "repository_relative_path": "control/generation_cutover.json",
      "base_commit": "ecb3e1b97cb339425ab7043134276b1751ed77ac",
      "git_blob_sha": "a9edf97df3ab5b4c54f2a4983ab795e76fd76a73",
      "byte_count": 2908,
      "sha256": "c893bbeaea795752589bcbd85268e917b69c109428dd690093da9202730d82ae",
      "source_status": "LEGACY_COMPATIBILITY_AUTHORITATIVE_INPUT",
      "plane": "CONTROL",
      "semantic_rule": "INHERIT_EXISTING_RECORD_MEANING_AND_AUTHORITY_NO_RECLASSIFICATION"
    },
    {
      "repository_relative_path": "control/migration_status.json",
      "base_commit": "ecb3e1b97cb339425ab7043134276b1751ed77ac",
      "git_blob_sha": "d13f47650adefff871a2104fdfae601d050b18ba",
      "byte_count": 560,
      "sha256": "b9e3e9456da598e7ca65b88f0c1033fc6f9c8597899dfd89cc4ab1436e4e8748",
      "source_status": "LEGACY_COMPATIBILITY_AUTHORITATIVE_INPUT",
      "plane": "CONTROL",
      "semantic_rule": "INHERIT_EXISTING_RECORD_MEANING_AND_AUTHORITY_NO_RECLASSIFICATION"
    },
    {
      "repository_relative_path": "control/repository_layout.json",
      "base_commit": "ecb3e1b97cb339425ab7043134276b1751ed77ac",
      "git_blob_sha": "723e7ff801d8b6210d00d2e3588e29b4a0f7fdd2",
      "byte_count": 1225,
      "sha256": "62ae17fb856c883c677be7f6904434bffe7f8f36d6fe61d3fe6b57d61e8251ba",
      "source_status": "LEGACY_COMPATIBILITY_AUTHORITATIVE_INPUT",
      "plane": "CONTROL",
      "semantic_rule": "INHERIT_EXISTING_RECORD_MEANING_AND_AUTHORITY_NO_RECLASSIFICATION"
    },
    {
      "repository_relative_path": "control/repository_policy.json",
      "base_commit": "ecb3e1b97cb339425ab7043134276b1751ed77ac",
      "git_blob_sha": "2940a9e3cffcc724a993e34b0ecd7636d12d9c05",
      "byte_count": 1286,
      "sha256": "b2d039d5a4c524c9dbdabf75e39510fd581c654353eccbe635316ffbeaa22003",
      "source_status": "LEGACY_COMPATIBILITY_AUTHORITATIVE_INPUT",
      "plane": "CONTROL",
      "semantic_rule": "INHERIT_EXISTING_RECORD_MEANING_AND_AUTHORITY_NO_RECLASSIFICATION"
    },
    {
      "repository_relative_path": "dispatch/C011/OFG-EA-T2-C011-G2.json",
      "base_commit": "ecb3e1b97cb339425ab7043134276b1751ed77ac",
      "git_blob_sha": "7054dce9ae1e6674aad77ee9e0dc8ffa3637d571",
      "byte_count": 3523,
      "sha256": "8b3722cdc50a935a7286f713e9add97573d22f7acf978c56fbfc9b34497a977c",
      "source_status": "LEGACY_COMPATIBILITY_AUTHORITATIVE_INPUT",
      "plane": "SEMANTIC_STATE",
      "semantic_rule": "INHERIT_EXISTING_RECORD_MEANING_AND_AUTHORITY_NO_RECLASSIFICATION"
    },
    {
      "repository_relative_path": "dispatch/C011/OFG-EA-T4-C011-G2.json",
      "base_commit": "ecb3e1b97cb339425ab7043134276b1751ed77ac",
      "git_blob_sha": "8493c886a5413efd2130ea62d32d837d9e0f6a07",
      "byte_count": 3646,
      "sha256": "5fe2c58a02ebeb230d7ab5eed5585c5c684a8c1ff9d1d4489abd60cb35b3bf26",
      "source_status": "LEGACY_COMPATIBILITY_AUTHORITATIVE_INPUT",
      "plane": "SEMANTIC_STATE",
      "semantic_rule": "INHERIT_EXISTING_RECORD_MEANING_AND_AUTHORITY_NO_RECLASSIFICATION"
    },
    {
      "repository_relative_path": "dispatch/C011/OFG-EA-T5-C011-G2.json",
      "base_commit": "ecb3e1b97cb339425ab7043134276b1751ed77ac",
      "git_blob_sha": "9497c11c504d63b46dc58e6575a7ab5e36c8440d",
      "byte_count": 3538,
      "sha256": "13c34ce79d8de5188ec7ac3c09e65f0101ab6351ce78a8468e5e40098194e279",
      "source_status": "LEGACY_COMPATIBILITY_AUTHORITATIVE_INPUT",
      "plane": "SEMANTIC_STATE",
      "semantic_rule": "INHERIT_EXISTING_RECORD_MEANING_AND_AUTHORITY_NO_RECLASSIFICATION"
    },
    {
      "repository_relative_path": "state/T1-G2_REHYDRATION_CAPSULE.json",
      "base_commit": "ecb3e1b97cb339425ab7043134276b1751ed77ac",
      "git_blob_sha": "55732a0593642b3862cb396f55a6a80baee02073",
      "byte_count": 16843,
      "sha256": "63b6aebb8e46a020821357d1ab0ab67ec7e334a38c2bfdffc4ffd7cdfa68db16",
      "source_status": "LEGACY_COMPATIBILITY_AUTHORITATIVE_INPUT",
      "plane": "SEMANTIC_STATE",
      "semantic_rule": "INHERIT_EXISTING_RECORD_MEANING_AND_AUTHORITY_NO_RECLASSIFICATION"
    },
    {
      "repository_relative_path": "state/T2-G2_REHYDRATION_CAPSULE.json",
      "base_commit": "ecb3e1b97cb339425ab7043134276b1751ed77ac",
      "git_blob_sha": "1519cd64a02fff52d4fcad3efe2cdb7ed37db7cf",
      "byte_count": 7589,
      "sha256": "4991bb4db3f9b26d68b95481e17b7b304c8b3dd92b5924d178b58bed06931a0a",
      "source_status": "LEGACY_COMPATIBILITY_AUTHORITATIVE_INPUT",
      "plane": "SEMANTIC_STATE",
      "semantic_rule": "INHERIT_EXISTING_RECORD_MEANING_AND_AUTHORITY_NO_RECLASSIFICATION"
    },
    {
      "repository_relative_path": "state/T4-G2_REHYDRATION_CAPSULE.json",
      "base_commit": "ecb3e1b97cb339425ab7043134276b1751ed77ac",
      "git_blob_sha": "8bf7897aaab157c1480c1f82f1099c0501a14bcd",
      "byte_count": 7669,
      "sha256": "57a1843fc0556884507b0e16fb1ad4f1c5f8b1cb0fde2f7ab74318fd25f48025",
      "source_status": "LEGACY_COMPATIBILITY_AUTHORITATIVE_INPUT",
      "plane": "SEMANTIC_STATE",
      "semantic_rule": "INHERIT_EXISTING_RECORD_MEANING_AND_AUTHORITY_NO_RECLASSIFICATION"
    },
    {
      "repository_relative_path": "state/T5-G2_REHYDRATION_CAPSULE.json",
      "base_commit": "ecb3e1b97cb339425ab7043134276b1751ed77ac",
      "git_blob_sha": "16ffe798fe357234fa700a3f1b47061846f278a5",
      "byte_count": 7286,
      "sha256": "9b77e75c74fb62e28580bd8a3a3be24f1af476304a5ce1b2f4d0c5ef732c2384",
      "source_status": "LEGACY_COMPATIBILITY_AUTHORITATIVE_INPUT",
      "plane": "SEMANTIC_STATE",
      "semantic_rule": "INHERIT_EXISTING_RECORD_MEANING_AND_AUTHORITY_NO_RECLASSIFICATION"
    },
    {
      "repository_relative_path": "state/active_cycle_c011.json",
      "base_commit": "ecb3e1b97cb339425ab7043134276b1751ed77ac",
      "git_blob_sha": "55ace452a5759a16b7838ed1387503f3787bb1f4",
      "byte_count": 1910,
      "sha256": "3ee94dc0f1bb22ceb4005151a234ad57bf3130d913d05ebc5678575e02cdf3ee",
      "source_status": "LEGACY_COMPATIBILITY_AUTHORITATIVE_INPUT",
      "plane": "SEMANTIC_STATE",
      "semantic_rule": "INHERIT_EXISTING_RECORD_MEANING_AND_AUTHORITY_NO_RECLASSIFICATION"
    },
    {
      "repository_relative_path": "state/c011_dispatches.json",
      "base_commit": "ecb3e1b97cb339425ab7043134276b1751ed77ac",
      "git_blob_sha": "e5b11ba2b388877a3f1ebeddf4605642e1e1c69e",
      "byte_count": 8371,
      "sha256": "c14effd74b1f57dfc6eeee4d521128fdeaed5c6cc9db7aeb94b18efaf8b5a173",
      "source_status": "LEGACY_COMPATIBILITY_AUTHORITATIVE_INPUT",
      "plane": "SEMANTIC_STATE",
      "semantic_rule": "INHERIT_EXISTING_RECORD_MEANING_AND_AUTHORITY_NO_RECLASSIFICATION"
    },
    {
      "repository_relative_path": "state/conflicts.jsonl",
      "base_commit": "ecb3e1b97cb339425ab7043134276b1751ed77ac",
      "git_blob_sha": "5cfbd3f8c0cbdcf9fca3d889aafd522c705a8a65",
      "byte_count": 1655,
      "sha256": "038fc90dc90fea4a1f5a17e976986abd1e8042e45cf3e6a4ceb50cb7280d2fd1",
      "source_status": "LEGACY_COMPATIBILITY_AUTHORITATIVE_INPUT",
      "plane": "SEMANTIC_STATE",
      "semantic_rule": "INHERIT_EXISTING_RECORD_MEANING_AND_AUTHORITY_NO_RECLASSIFICATION"
    },
    {
      "repository_relative_path": "state/current_working_state.json",
      "base_commit": "ecb3e1b97cb339425ab7043134276b1751ed77ac",
      "git_blob_sha": "858f1dc334cd14aa4d2ada6485cccc702ba3cc8e",
      "byte_count": 14151,
      "sha256": "aa6995f7becd5bad15b10ede21b9257a4f0106c42036fe002d394940e96b1ca1",